{
  "schema_version": "pfn.v1",
  "event_id": "5f0e0000-0000-4000-8000-000000000014",
  "trace_id": "5f0e0000-0000-4000-8000-000000000001",
  "request_id": "5f0e0000-0000-4000-8000-00000000000b",
  "source_node_id": "NODE-RPI5-01",
  "status": "task_requested",
  "task_id": "5f0e0000-0000-4000-8000-00000000001e",
  "ai_intent": "DEVICE_CONTROL",
  "ai_device": "LIGHT",
  "ai_action": "TURN_ON",
  "safety_flags": [],
  "clarification_question": null,
  "model": {
    "name": "exaone-1.2b-homemind-v1-q4_k_m",
    "origin": "model_guard",
    "latency_ms": 241.0
  },
  "completed_at_ms": 1792560000400,
  "simulated": true
}
